504	"Little Women" has been a personal favourite of mine for many years now. It is a beautiful reflection on the simple, yet equally important things in life, like love, family and ambition. Featuring wonderful performances from a star-studded cast, beautiful cinematography and tranquil music, "Little Women" has remained one of my favourite films of all time.Based on the novel by Louisa May Aclott, "Little Women" follows the lives of the four March sisters: Amy (Kirsten Dunst and Samantha Mavis), Beth (Claire Danes), Meg (Trini Alvarado) and the main character Jo (Winona Ryder). Following the absence of their father, who is serving in the war, the March sisters stick together, their bond strong. The story takes us on the individual journeys of each sister, especially Jo, an apsiring writing who wants nothing more to make it in the world dominated by men. Through boy-trouble, peer pressure, and a personal tragedy that rocks the family, Jo and her sisters try their best to stick together as a family. "Little Women" shows us the bittersweet transition from childhood to adulthood.The performances in the film are inspired. Susan Surrandon stars as the girls' kind and loving mother, and as usual portrays her character beautifully. Winona Ryder gained an Oscar nomination for this film, but the true star of the film, in my opinion is Claire Danes. Her role in the film, although being the least explored of the four girls, is so powerful and evokative, coming from just a 14-year-old Danes. A somewhat younger Kirsten Dunst is flawless as the young Amy March, though I must say that I disaproved of the casting of the older Amy, Samantha Mavis. Her performance was unbelievable, let alone the fact that she did not look anything like her younger self. Despite this the acting was very well done.The scenery is absolutely stunning! I simply love the images of the heavy snow, the golden Fall, the cosiness of the candle-lit living room. The scenery really draws you into this 18th century world, and gives you a wonderful fuzzy feeling inside.The music, personally is one of my favourite movie scores ever. Composer Thomas Newman blends tranquil string meleodies, with elements of oboe and a particularly heart-wrenching piano-solo (to name a few highlights), to really bring out the pureness of this movie and its morals. The music adds character and feeling to every scene, as every score does, and its simply gorgeous!My only reservations for this film would be that its final forty-minutes or so does not evoke that "magicalness" of the rest of the film. However, there are nevertheless some shining scenes, one of which I cry in every single time I watch it! (I shall not say what it is, or I will spoil it for anyone who hasn't seen it!)So in conclusion, the acting, cinematography and music combined make this film one of my favourites. Despite some mismatches in role-casting and editiing, I believe this is a near-flawless film, and certainly one of the best adaptations of a classic novel there's ever been.	4
505	I've only seen two of the movie versions of Little Women, this one and the 1949 version, and I must admit I prefer this one. Not to put down the 1949 film, which is super charming and lovely and has the superior Jo (June Allyson, love her), but I think the 1994 version is a more coherent movie. The 49 version was clearly meant to stick closer to many of the book's storylines, but in doing so, I think it gave up a lot of character development between the sisters. This version makes me cry, always, oh God, how it makes me cry (it's pathetic, really...haha) and has terrific music and also Gabriel Byrne! Gabriel Byrne, you guys, come on. (In other news, is it so hard to find a German actor to play Mr. Bhaer?) ANYWAY. This movie certainly isn't without its faults (i.e. weird casting choice on grown-up Amy) but it's my personal favorite.	6
506	This movie is great! I love Christian Bale, Winona Ryder, Susan Sarandon, Claire Danes, Gabriel Byrne, Trini Alvarado, and, yes, Kirsten Dunst. However, this movie is not completely true to the book, as no movies truly are. They completely left out the beautiful conversation between Marmee and Jo about their tempers, Amy had the turquoise ring before ever going to Aunt March, Amy wasn't transformed as in the novel but she continued to seem to be a selfish girl, the transformation in Meg wasn't shown, and there wasn't enough of Beth! BUT, I love this movie for the acting, the warm homey feelings, and the fabulous clothes/hair/home made meals. haha	1
507	appreciated that the item was sent out ASAP and received in excellent condition...would use this vendor again...	6
508	This movie is a trip into the past when life was not so busy and stressful, as it so easily can become today.  Life was simple and children had time to dream and use their imaginations.  Family took first priority above everything for most people and strong bonds were formed out of love and necessity.  All this was presented in this movie through good script writing and good acting.  We appreciate good, clean movies with uplifting and encouraging messages.  This movie ranks high among our favourites.	6
509	This is the kind of movies we love.  We enjoyed it so much thatwe ordered two more of the movies from this set.  Haven'treceived them yet but we are excited about them.	4
510	this movie is for all sister,it is a love story for sisters,i enjoyed and ceased every moments.thank you amazon !for excellance in every way possible,	6
511	My grand daughter is age 10 and she  loves to read. I had an easy version of the original book that she read, then wesaw the latest movie  and now she just wanted to read the original book.  She is loving it.	6
512	The book Little Women is a classic and so is this movie! Little Women captures everything Louisa May Alcott intended in her well loved novel.This movie is about 4 sisters growing up during the Civil War. A temporary poverty had settled upon their home and the girls and their mother, Marmee ( Susan Sarandon ) are doing their best to cope. Winona Ryder plays Jo, the 2nd oldest, Trini Alvardo plays the oldest, Meg. Claire Danes portrays Beth the 3rd oldest, while Kirsten Dunst captures the youngest, Amy.The film follows the girls over a course of roughly six years. It portrays their triumphs and tragedies, losses and gains, with heartfelt laughter in between. Some of the scrapes the girls get into is Jo attempting to teach Amy school, Meg making a fool of herself at a party, and whilest Beth tries to help her sisters get along. And of course everything changes when the girls meet Laurie, the rich boy next door.This movie is perfect for mothers and their daughters to watch together. It emphasizes family values, good morals, and also teaches life lessons along the way. This movie is worth your time! Join the March girls on an unforgettable adventure that you will never forget!	6
513	I mistakenly rated this a 5 star before realizing this is the version I returned,did not want, and ordered the one with the cast of the original I saw, starring Margaret O'Brien, June Allyson, Liz Taylor, etc., which in my memory rated a 5.  I am waiting for time to view it when I will not be interrupted by caregiving for an ill family member.  Thank you.	4
514	I first read the book a few years ago (I've always loved what guys call "Chick Lit"; yes, I'm very sentimental; most guys aren't; they're basically unemotional pigs who think only about sex) and loved it. I love period films anyway. BOOK & MOVIE SPOILER AHEAD!!! I cried when one of the major characters dies. She reminds me very much of my best friend who has always been there for me. The cinematography was absolutely stunning. Winona Ryder (who was excellent in dual roles in Francis Ford Coppola's epic masterpiece "Bram Stoker' Dracula") is equally superb here, with Kirsten Dunst (fresh off her biting debut in "Interview With The Vampire"), Susan Sarandon, Claire Danes, Trini Alvarado, Samantha Mathis, Eric Stoltz, Christian Bale ("Empire Of The Sun," "Henry V"), Gabriel Byrne & Mary Wickes ("Now, Voyager") rounding out the cast. It's a faithful version of the story with absolutely nothing objectionable for family viewing. It received the PG rating for thematic elements (situations involving death). This is the kind of film that Hollywood rarely makes anymore (the seriously underrated classic "Mary Shelley's Frankenstein" would be released the following year along with two excellent adaptations of Jane Austen's books: "Sense And Sensibility" &"Emma.") I HIGHLY RECOMMEND ALL those movies.	6
515	I LIKED IT SO MUCH I CAN NOT SAY ANY THING  BUT WONDERFUL !!!!!!!!!!!!!!!!!!!!!!!!!!!!!!!!!!!!!!!!!!!!!!!!!!SO FUN TO READ YOU CAN NOT PUT IT DOWN!! ON 2ND THOUGHT THERE WAS ONE DISAPOINTMENT IT CAME TO AN END!!!!!!!!!!!!!!!!!	6
516	The film was a tad insipid....in any family there are conflicts.  Also, the father (I realize he wa away much of the time) was like a footnote in the family. I would have liked to see more of the relationship between Marmee and the Captain.	6
517	i have watched this movie several times but never get tried of it.i love everything about i think every house hold should owen at least one copie.thanks	6
518	This is how movies should be done. Talented cast, and a well written script. It has heart and soul, it warms your heart.	1
519	This movie is fairly good. I like Christian Bale as Laurie, he played the part of the charming, handsome next door neighbor very well. I liked Kirsten Dunst as the young Amy and for the most part I liked Susan Sarandon as Marmee. What I didn't like was the modernising of the tale. Marmee's feminist rant against corsets was ridiculous and Meg refusing to wear silk was strange since in the book she wants a silk gown. Also Gabriel Byrne is much too handsome to play the part of Prof. Bhaer. And no offense to him, but his German accent was atrocious. And I didn't like Marmee giving Jo the idea of turning Plumfield into a school. Jo came up with that on her own. Still, overall a decent if not faithful movie.	6
520	I've had this movie for quite sometime, and watching it never gets old! Each time I laugh when Jo tells Laurie in the beginning at the ball, "Meg's completely bald in front." You will not be disappointed with the quality of this rendition of L.M.A.'s beloved story.	6
521	I LOVE this movie. I can watch it over and over again.  The characters are just great. The story is strong. It covers family bond and strength, friendship and love.	6
522	I have seen all of versions of Little Women.  However, with the music and the scene where Beth dies and Joe is remembering is the most touching scene in movie history.  The acting is up to date and not mushy like the others.  Most of all Beth dying made me cry up to about the seveth time.  I guess I`m all cried out.A great versiion.	6
523	I bought this DVD as a gift for my wife.  She loves this movie.I ordered the movie via amazon.com and it came from a different seller, but everything went smoothly.  I had no issues and not concerns when the movie arrived.  I was going out of town for the holidays and the movie arrived in plenty of time for me to take with me.	6
524	This is an excellent movie.  Excellent family entertainment !  Great for tweens and teens too. The acting is very good and the costumes and d&eacute;cor seem to fit the times.	6
525	Haven't watch it yet.  just replacing my tape but will be watching it soon.  Thank you for having the dvd.	6
526	The cast in this edition is wonderful, especially like Susan Sarandon as the mother of the girls.  A wonderful classic brought to life.	6
527	This movie brings all the joys of home on to the screen it is so diverse also it is great as a holiday movie or just a hot summer day when their is noting to do Claire Danes is great you really feel for her a treat for all  ages.	1
528	I first got Little Women from the library and I loved it so much that I bought it several hours later after work.I am a big fan of the book and I am glad that they stayed very close to it. The scenery and the score tie the movie together beautifully. I like how they stayed away from casting beauty queens and hunks but chose realistic people. This is a must see for anyone who likes the book, period pieces, or just good old-fashioned movies. Marmee can be a little preachy about the rights of woman but she was in the book to. All in all, it is very good entertainment.	6
529	I liked the first half, but in the second half Jo becomes a mealy mouth girly girl. And everyone who was surprised that it is a good movie never read the book.	6
530	Of all the versions of Little Women that I have seen, Gillian Armstrong's is the best!  She definitely chose her actors/actresses well - the cast includes: Winona Ryder (Jo), Claire Danes (Beth), Trini Alvrado (Meg), Kristen Dunst (Amy), Christian Bale (Laurie), Susan Sarandon (Marmee), and Gabriel Bryne (Professor Bhaer).  What an astounding performance they gave - this movie made me laugh, cry, and feel for the characters each and every time I watched it!  . . . And though some of my favorite scenes from the book were missing, it still portrays the characters extremely well.  I love this movie and highly recommend this to all Little Women fans, the people who didn't bother to read Little Women, and everyone else!	3
531	I love amazon prime and now I get to watch my favorite movie of all times anytime I want without having to dig out the DVD. Thanks, Amazon. You rock!	6
532	well i gave this movie a 1 star but if i could i would have gave it a 0. although the acting is good this film is so boring you can't even concentrate on it.  I tried to sit through it but you talk about boring. i  mean come on.  but maybe its just me but if your thinking of buying or  renting i would pass on it unless your into boring movies	41
533	This is a great movie to watch any time of year, but especially around the holidays.  The all-star cast, including Wynona Ryder, Claire Danes, Susan Sarandon, Christian Bale, and Kirsten Dunst give amazing performances that feel like you're watching a real life drama play out.  Just be careful, make sure the kleenex are nearby.  A must-have!	4
534	This movie is horribly written, horribly cast, horribly directed and poorly acted. It seems that they just took several young actresses popular at the time and dumped them into the movie with no thought at all about whether or not they fit the part or were capable of playing the roles. I think it is interesting to note that none of the actresses playing the sisters have had successful careers. None of them became big stars. The movie leaves out some of the best scenes in the book completely. One of the most touching things in the book is the relationship between Beth and Mr. Lawrence - totally ignored here. And, Beth is just too big for the role, not gentle enough. There is no really clearly drawn difference in the sisters. For several scenes I couldn't tell Meg and Jo apart. Now, if you never read the book I guess you might enjoy this movie but if you have read the book, many times as I have, then you are going to be horrified. Winona Ryder is a joke as Jo and all the other sisters are also terrible casting. There was no narrative by Jo in the book so why have they dragged it in here. I won't even mention Eric Stoltz as Mr. Brook. Somebody must have been on drugs when they cast him in that role. The movie skips over a lot of things that are important to character development and to the story. It's like a caricature of the story made to sell tickets to young people who have never read any book much less this one.  The scenes where Jo kisses Professor Baer at the opera and in the boarding house are ridiculous. No well brought up young woman in that time would dream of doing such a thing.  A kiss would have been permitted only if they were formally engaged. And, if the children's mother caught a glimpse of a romantic relationship between the governess and one of the roomers, Jo would have been out of the house in record time and so would he. Who on earth writes this crap. The nondescript father of the family finally shows up in a couple of scenes but I don't recall him ever saying anything. If you want to see "Little Women" then get the original with June Allison as Jo and Peter Lawford as Laurie. Margaret O'Brien just IS Beth. Elizabeth is a really "dead on" Amy and Janet Leigh is just right as the very proper Meg. See that movie, then you'll be able to see what is so wrong with this film.	11
535	Little Women is a classic, and this version of it is my favorite. I love Winona Ryder in it. Actually I love the performances of all the actors and actresses in this movie. It's just one of those feel good movies, and I always save it to watch at Christmas time. I already owned it on VHS, but wanted to have it on DVD. My daughters and I watch this movie every year and love it. We have lots of favorite quotes from this one! (Jo, how could you? Your one beauty!)	6
536	This is an excellent movie, with great acting and a warm storyline.  Such a classic tale, that has embraced young girls for generations and generations.  I loved the book when I was a child, and when seeing this movie, it brought back all those wonderfully warm emotions to surface again.  This movie is like a visit from an old friend.  However, if you have not read the book, I think you'll still find it enjoyable.  The movie differs from the book, but I don't want to give anything away, so I cannot elaborate on what is different.Watch this movie with your daughters!  It was a wonderful mother-daughter bonding movie... don't miss it!	6
537	This is an all time favorite of mine! It is an incredibly inspiring story for young girls! This movie will always be a staple in my movie collection!	6
538	have loved this story for so long and love this particular version the most be ready to laugh and cry with this one	6
539	A wonderful, touching story of love, family, friendship, loss, and change.  After reading the book many times I did not think a movie could capture the same feelings.  But this one did, and that's saying a lot for my  favorite book. Hearing the song &quot;For the Beauty of the Earth&quot;  brings me to tears now.  Thanks for the memories.	1
540	It's a sad commentary on the state of political correctness when a book written in the 19th century has to be &quot;updated&quot; instead of being preserved as a precious reminder of times gone by. Are filmmakers so concerned with the bottom line that they don't think viewers are capable of recognizing a historical setting for what it is? The virtue of the novel is in its message - that love is eternal, surpassing youth, beauty, and riches. What part of that message can't be understood by a modern audience without &quot;sanitizing it for our protection&quot; against mores of bygone days? Why must we be hit on the head with the Anvil of Political Consciousness in a story where those notions had yet to be brought to the fore?If the people making this movie had been truly interested in finding feminism in Louisa May Alcott's text, then they missed the boat in three enormous ways:1. They made Jo the prettiest girl. That casting move left all of her lines about being an awkward tomboy sound as if she were fishing for compliments. What would have been so terrible about having someone less model-waif-starlet take the role? Go back and watch June Allyson and Katherine Hepburn in their turns as Jo - they weren't prettied up by the makeup artists and photographers, and it makes them all the stronger. By making Jo so lovely, the film accidentally moves against feminism by falling into the stereotype that even &quot;little&quot; women have to be beautiful. (To be fair, they also make Professor Bhaer unrecognizably handsome, missing the point for the male as well as female characters.)2. They ignored the subtle textual references about Marmee having as severe a temper as Jo. Instead of showing Marmee shouting out a window about not wearing corsets, why not show her working to control her emotions for the good of her family? Why not show her desire to work for the betterment of the poor as an outlet for her frustration over being left at home? Can you imagine what Susan Sarandon could have done with material like that?3. I'll grant that it would be hard to portray the changes in Amy, because in the novel most of them are happening in description rather than in her actions. Simply changing actresses in mid-stream isn't enough - we should have seen her growth from inside, her desire to become a good person rather than a rich one. Instead of seeing Laurie as her just reward for having made such a difficult journey, as we do in the book, it comes across as irony that someone so selfish should wind up with the rich boy next door.Thanks, but no thanks - I'll go back to Katherine Hepburn or June Allyson (even though in the latter version it's obvious Joan Bennett was pregnant when she portrayed Amy), and take my message undiluted.	81
541	It's not the A&E; Pride and Prejudice version when it comes to accuracy, but the care the screenwriters went to in order to make this true to the book (yet interesting to a film audience in ways that a straight book-film version would not have allowed) is what makes this movie such a masterpiece.  The most important and memorable scenes are made dutifully true to Alcott's original, and the actors are almost always believable (older Laurie seems a little forced at times, and that is honestly my only acting complaint).However, much of the dialogue is very soft, and while I don't remember having this issue the first time I saw the movie (about six years ago), I recently watched it again and found that I was looking at the subtitles a lot since I couldn't hear the full sentence.  I am not quite 20, so I think it is less of a problem of my own hearing as it is the fault of track editing.When I first watched this movie, I was moved to reread the book, and found it much more enjoyable than the first time I read it.  After again seeing the movie, I hope to be able to read the book yet again - it just has that effect!	2
542	ALTHOUGH I LOVED THIS MOVIE, IT HAS A TON MISSING ALSO, COMPARED TO THE ORIGINAL.  THERE IS NO PARTOF THE MOVIE END, WHEN THEY GOT MARRIED, AND STARTED THE BOYS SCHOOL,	1
543	This is one of my most favorite Christmas movies. It's not exactly a holiday movie but takes place during the holidays. It's a total work of art...beautiful filled with memorable characters. It really does the book justice.	6
544	To be honest I was a bit wary of watching another "remake" of Louisa May Alcott's book "Little Women." I had seen the versions with Kate Hepburn, June Allyson and the NBC television version with Susan Dey. However upon a friend's urging I checked this version out from the library to watch. After viewing the movie all I can say is this is a delightful interpretation of the timeless classic. The movie was well cast, scripted,directed and scored. The movie flows flawlessly from beginning to end. I have no idea why this movie was given a PG rating it is definitely a "family film." This movie is a great follow up to reading the classic story.	5
545	This is a great book for anyone to keep in their library.  I've read it twice and watched the movie many times.	6
546	My favorite movie - powerful acting - costumes true to period - details adhered to - Feel all characters accurately represented (with the exception of Laury). If you are only getting one Little Women purchase this one.	6
547	This is a great movie for an amazing book, I was very pleased with the price and quality from the DVD, its a classic every family with little girls should have!	6
548	I love this movie; it's a classic in my household. Although it doesn't follow the book, it is a very good movie for all families and people to enjoy.	6
549	This movie is one of my ABSOLUTE favorites!! I can't tell people how much I love this remake of the original. I never actually watched all of the original because I like this version better. The first time I saw this remake, I was 12, and I'm almost 19 now, I still watch it! I tend to watch it around Christmas or when it's cold and snowy outside because that was what the time of year it was when I saw the movie! I curl up infront of the tv, covered by a blanket, and a cup of hot cocoa. Everyone says they don't like this version because it doesn't compare to the book. Well to tell you all the truth, I prefer every movie over any book any day! I tend to not like books much anyway, so I like the movie. But this movie has been a favorite of mine, my mom's, my old school friends, and my young cousins! Even my brother watches it, and he's over 21! It's a fantastic movie, and I think everyone should see it!	1
550	The movie is great! It came on time and and it works just fine. There is really noting else to say!	6
551	Great service on delivery time, but unfortunately, the sound quality was bad. We started to watch the movie on Christmas eve, but had to stop because we couldnt hear the voices!!!! Disappointing...	1
552	Watch this movie on a Saturday afternoon all alone and eat lots of candy. Very nice movie, a good way to pass the time. Not to mention that you have the eye candy of Gabriel Byrne to munch on when things get dull.	2
