584	Gillian Anderson's LITTLE WOMEN attempts not so much to capture the essense of Louisa May Alcott's original story as to use it as a springboard.  It might have been better if she had transferred the story to a different time, or otherwise re-framed it so as to give herself more liberty to change things around.  I myself would not have minded a version of LITTLE WOMEN where Laurie and Jo DO run away, Beth sneakily brings in much needed cash as dance hall pianist, and Professor Bhaer finally learns to mind his own business.  But instead, screenwriter Robin Swicord drains the drama and momentum from the original by pointless alteration, but is still required to hit major plot points, and so cannot create anything new and satisfactory.What made Alcott's LITTLE WOMEN, despite the moralizing, something children have wanted to read for one and a half centures now was its vivid portrait of passionate adolescence: Jo's famous temper, Laurie's rebelliousness, Amy's spite, Meg's longings - even what lurked beneath Beth's shyness.  Anderson jettisons this anger and passion for a genteel and straight-laced Art-House flick about ladylike little feminists.  Alcott famously disparaged her books for children as "moral pap for the young", but LITTLE WOMEN had honesty and substance.  Anderson ignores the substance in favor of "moral pap" - albeit politically correct and feminist pap - washed down with tony sentimentality.  The only notes of truth are struck by the performances.The girls are just not the same girls, with mixed results.  Kirsten Dunst - fresh from INTERVIEW WITH A VAMPIRE - is a superb child-Amy, but is written as a sly vixen with designs on Laurie, which ruins the honest connection between them that was so important later.  Adult Samantha Mathis plays Amy as a dense zombie.  Trini Alvarado brings tremendous grace and womanliness to Meg, which is really nice actually, except that Meg is supposed to be an unsure adolescent.  Winona Ryder's Jo is interestingly different, which is to say she isn't a rebellious tomboy with a wild temper and a burning literary passion, but a thoughtful-if-pouty wannabe Liberal Arts Major.  Beth is supposed to be a frail girl struggling mightily with her timidity: Claire Daines gives us a sturdy lass placidly devoid of inner conflict.  Thus we must lurch through the plot of LITTLE WOMEN, without getting the Little Women themselves as compensation.Christian Bale, as boy-next-door Laurie, does a good job of suggesting caged wildness, and makes the most of the few poignant lines which are all that is left of Laurie's tempestuous relationship with his grandfather.  But he is just a little too old, too smug, and too smarmy.  Alcott's lonely, emotionally-deprived teenager is barely hinted at.  Rather, he has become a representative of "Men", which you know is just not good.  In the book, Laurie's reaction to seeing Meg dolled up like a sexpot was sudden bashfulness and defensive rudeness.  Here he is a suave sexist oaf who sees Meg's new finery as the opportunity for a spot of sexual harassment.  Ew!  Why?  The point of Laurie and Jo's dance, in the book, was to convey the pleasure of meeting a soulmate one could show one's real self to without worrying about being "presentable" or "proper".  Here, their dance is rendered somewhat awkward by the fact that Jo only knows how to lead.  This alters the whole meaning of the scene, implying Anderson sees it as a power struggle rather than a moment of connection.  And it's so dismally clich&eacute;.  "Oh, they are both too strong-willed so . . .."  You know something?  Being weak-willed and knowing how to dance backwards have NOTHING WHATSOEVER to do with one another.In the directors's commentary, Anderson describes Alcott's Marmee as the "perfect" mother.  She was not!  Anderson obviously doesn't think the March parents were perfect either, as her version replaced Marmee with Susan B. Anthony, and shuts Father up completely.  But instead of admitting it and portraying Marmee as a flawed human being, she simply replaces her own PC notion of perfection for that supposedly offered by Alcott.  Susan Sarandon does as amazing a job as one could possibly wish, considering that she's being asked to play a marble statue instead of a woman.  Some have suggested that Saradon's portrayal would have been more convincing in another era, but I disagree.  Her Marmee says nothing feminists didn't say at the time - in essays and speeches.  Alcott's trashy adventure-potboiler A LONG FATAL LOVE CHASE has quite a few feminist speeches, and as ALFLC is scarcely attempting naturalistic realism, they fit in just fine.  No, it is Marmee's cardboard-cutout supermom-hood which rings false - in any era.There is inherent feminism to be found in Alcott's work, to those interested in Alcott's work.  But those people do not include Anderson and Swicord.  Scene after scene is rewritten to ignore and replace the actual story rather than intepret or illuminate it.  John Brooke takes Meg to the theatre, only to spout stock rubbish about how sinful, immodest and unladylike actresses are.  Writer Jo faces sexist discrimination from New York publishers, and discusses female sufferage with Herr Professor.  Meg and Sally Moffat argue over child silk laborers.  The doctor throws in a line about bleeding, and throws in the towel on a patient who is promptly saved by Super-Marmee.  Amy's doting schoolmaster who very reluctantly struck her for disobedience is now The Sexist Educational Establishment, and is given that line comparing female students to female cats which is scarcely what a poor man who earned his living educating young ladies would say.  Thus generic Victorian clich&eacute;s gleaned from speed-reading a few history books replace the situations created by a woman who was actually THERE, and incidents borrowed from Alcott's life are thrown in without context or point.  I'm surprised nobody found a runaway slave in the oven.  Or did I blink?The script is so ham-handed that on the occasion we do get something of Alcott's, it no longer makes sense.  Take the skating accident.  In the book, Jo is so furious with Amy that she refuses to speak to her, even to warn her of thin ice.  Then she freezes in shock when Amy falls through, leaving the rescue to Laurie.  The line "How could I be so horrible?  Thank God for Laurie!" would therefore make perfect sense.  In the FILM, Jo knows nothing about rotten ice, is blameless for Amy's accident, and is as quick to the rescue as Laurie.  But Swicord includes the now-senseless line anyway.  This book chapter ended with Jo's realization that "perfect" Marmee had as fiery a temper as Jo herself.  This liberated Jo from her self-loathing and despair, permited her to forgive both herself and Amy, and the chapter ended on a kiss.  The subtextual message is that we manage our darker feelings better when we acknowledge them, that we strangle our ability for love when we don't acknowledge our anger, and that there is no such thing as the perfect woman or mother who lacks the full range of human feelings.  That is more feminist and timeless than whining about corsets, and even has something to do with the plot and characters.  So of course it's not included.Another chapter that would have rewarded feminist interest was when unfashionable Meg allows herself to get nicely dolled up at Moffat's, only to find she has ruined herself in the eyes of conservative acquaintances.  But in the film, Meg looks EXACTLY like all the other girls present, and never hears any censure for crossing an invisible line of modesty.  She merely seems dressed for the occasion.  Yet she allows herself to be thoroughly shamed by Laurie, and (in an even creepier scene) cries repentantly while taking off her makeup.  What could easily have been a commentary on the eternal feminine double-bind instead comes across as a Puritanical slam against femininity itself.  Marmee's advice on modesty, in the BOOK, addressed Meg's need to protect her self-respect and the integrity of her relationships with men in the face of the "marriage market" mentality, but she specifically defended Meg's desire for prettiness and admiration as right and harmless.  Anderson's message amounts to "Men are Beasts, girls!  So COVER UP!" which doesn't seem terribly progressive somehow.  Still, the scene where Meg, Jo, and Marmee discuss the incident is among those where the actresses transcend their material.This movie is not BAD, mind.  It is at it's best showing the girl's at play, doing the Pickwick Club, or putting on amateur theatricals written by Jo.  But some scenes are too stupid for words.  Bale and Mathis deserve awards for professionalism for enacting the lamest screen courtship ever allowed to succeed.  I don't expect Mr. March to get any LINES, but an award winning director should make the actor look line a man in his own home, rather than an Alzheimer's patient who wandered onto the set.  A character in England reads a letter from America, throws it aside UNFINISHED when he gets to the dramatic part, and rushes out the door to catch a boat to Vienna.  Meg doesn't tell her own sister she's pregnant in private letter because "One doesn't speak of such things".  Amy doesn't burn Jo's novel in the heat of anger, then grow fearful and repentant by the time Jo comes home.  She burns the novel AND acts fearful and repentant all in the same 60 second period.  Then there is the skating scene, wherein the "rotten ice" is clearly ROCK SOLID as though the hole were sawed out by a cartoon character, and which bears the weight of two fully grown rescuers who suicidally throw themselves down side-by-side next to the edge.  They then wave a oar around just because there was an oar in the book, and not because they are using it to any purpose.  If Anderson ever directs an action film, I'm not seeing it.Last but not least, "strong-minded" Jo doesn't come up with the idea for Plumfield on her own.  She does it because Super-Marmee TOLD her to.  We are dealing with the sort of twisted minds who read LITTLE WOMEN and thought: "Gee, that wasn't bad, but Marmee should have put HER oar in a bit more often."	11
585	It is such an amazing movie! This is my second copy of this movie. I loved watching it so much that I had to get a newer copy in order to enjoy some more. The sister who plays the piano was super. All the sisters in this movie had such wonderful chemistry. Christian Bale was outstanding. I love how he came to maturity. He loves Jo so much and then he was able to marry Amy. This movie is so much fun to watch!	6
586	I have seen this movie before and loved it. I was just in the mood. I think all of the actors played their roles beautifully. It is warm and loving story.	1
587	i seen this movie on tv ,fell in love, and what can i say bought it and in great condtion!!	6
588	Bought this for our daughter since we already owned one.  We watch it every Christmas season and it brings back memories of the first time we saw it together as a family&#60;3	6
589	A beautiful movie that comes from a beautiful book. Rarely do I find a movie that is better than the book. This is one of those movies.The casting was excellent, the music was inspiring. The story was as touching and moving as the first time I read the book. I love the version of the movie starring Kathrine Hepburn, but this one surpasses even that in all its creativity and imagination. Small detours from the book are hardly noticible, and are forgotten in the splendor of this already enchanting movie. Truely worth all five stars.	2
590	This is a timeless classic of historical fiction that tells a story of how it was for women during a time when strength of character and imagination were of up-most importance to live a fulfilling and purposeful life.	6
591	The product came quickly and in good shape..I will use again..I was satisified..this says i have to use more words but this is all i have to say	6
592	Little Women by Louisa May Alcott is a wonderful book and this is a beautiful rendition of the book.  It beautiful captures the warmth and complexity of the relationships! Susan Sarandon and Christian Bale bring depth and believability to the roles of Marmee and Laurie.  All of the actress playing the sisters are wonderful in their own ways. The only roles that could have been developed a bit more are Mr. March and Mr. Brooks, and that is because these are rather two dimensional characters in the book.I could watch this movie again and again!	6
593	ordered this because we were both autiditoining for this show. That way we can wathc it and know what play is like	1
594	I bought this video and expected it to be "NEW" (according to its description), but it was scratched. It skips at a certain point in the movie. I don't know if I'll buy anything from this seller again.	4
595	I took my girls to see this heartwarming early 1990's remake of Little Women at the movie theater.  I remember thinking the whole experience was a special gift to moms and daughters!We bring out the DVD out every year at Christmas and the soundtrack is a staple for our holiday music!  Now to have the book and the DVD together in a gift set is especially sweet.  Whatever changes made while transforming book to movie were done so subtly that the movie still gives great homage to Alcott's story of Jo and her sisters coming of age!  My girls are now 21 and 30 and we still get together once a year at Christmas time to bake cookies, have some hot chocolate, and enjoy this beautiful film- and what fun it is to see Winona Ryder, Christian Bale and Kristen Dunst at such young ages!  And as always, Susan Sarandon is tremendous as the wise and loving mother.  This movie has not lost any of its original wonder, and certainly has not become out of date as so many remakes can become!  I would highly recommend it to everyone!	6
596	How I wished I was a part of this family! So loving and close knit!Great acting and scenery.It seemed deeper than just acting.I simply loved it!	6
597	A classic story told with an all-star cast.  This is one of my seasonal favorites without a doubt, even though it isn't a Christmas movie, snuggling up by the fire with this tale is perfect!	6
598	This was a gift and as far as I know she loves it. Great for those who enjoy classic movies.	6
599	This movie is great for the whole family. It is a nice reliable movie that all ages would enjoy. I would definitely watch this movie if you havn't already. A++	4
600	This was received as posted.  New and still in clear wrapper.  Excellent movie.  Read the book for book club and thought the DVD would help in discussion. Thanks	6
601	She loves it, great movie, wonderful for young girls.  I wish there were more movies like this.  Easy for her to download onto her kindle	2
602	I remember seeing this movie in the theater, resigned to hating it, but I think that it's the best rendering of _Little Women_ ever done. Winona Ryder is better than Katharine Hepburn. The music is excellent.	6
603	When I was in film school I had a professor who would constantly show clips from Winona Ryder movies when demonstrating film style techniques.  Inevitably we ended up watching many moment from Little Women - more than I would have liked.  Nonetheless, my girlfriend loves this movie.  What can I say?  It's Little Women.  You either love it or you don't.	1
604	Love! Love! Love this adaptation of Little Women!	6
605	One has to ask, did we really need another version of Louisa May Alcott's classic novel?  Well, even if we didn't, we have to give director Gillian Armstrong a big round of applause for her beautifully filmed and acted LITTLE WOMEN.  Winona Ryder as Jo was nominated for a Best Actress Oscar and is exquisite in her role as the wanna be writer who chronicles the adventures of her family, particularly her relationship with her three sisters.  Susan Sarandon does a nice turn as Marmee, the girls devoted mother, whose husband is off at war and rules the family with a smooth assuredness and grace.  Mary Wickes is fine as Aunt March; this late actress who was so memorable in the SISTER ACT films brings a naughty edge to her role.  The casting is perfect:  Trini Alvarado as Meg, the rather bashful sister who ends up marrying a poor tutor (Eric Stoltz); Claire Dane is the quiet and doomed Beth, who feels "left behind" when her sisters go off on their own; Kirsten Dunst plays Amy as a youngster and her joyful youth and innocence is marvelous; Samantha Mathis does well in taking over Amy's role as a young woman.  Christian Bale (our new Batman) does a nice job as Laurie, the young man who woos Jo to no avail, and ultimately ends up with Amy.  I think the most disappointing aspect of this rendition is Gabriel Byrne's Professor Baer.  It is ironic that his relationship with Ryder is the movie's weakest and although it doesn't totally diminish its quality, I think a different actor might have made it a perfect version.  As it stands though, LITTLE WOMEN is an enjoyable movie, filled with the richness of the time and the familial love Alcott so delicately portrayed.	5
606	This is a great and touching version of the classic story. Beautifully filmed, a joy to watch. I will usually watch this twice a year around Thanksgiving and then again at Christmas. Also if your a soundtrack for movies fan I highly recommend this for your collection.	6
607	When I first saw this movie when I was little I diddn't understand what it was about but I watched it anyway. Later in life while cleaning out the movie case I poped it in and watched it. Later I found myself watching it over and over again about 50million times. I love it and It's deffinetly a classic. For younger viewers it might be a yawn but if you have a little bit of culture in you you'd ejoy this musically, beautiful film.	1
608	Enjoyed this version of the classic Little Women immensely.  Even my husband enjoyed it. I highly recommend.	6
609	This movie is ok, but I prefer the 1949 one with Elizabeth Taylor.  I hated Winona's acting, and I didn't like how Gabriel Byrne played Prof. Bhaer in this movie.  But good thing Christian Bale was in it.This one is ok, but the 1949 version is much better.	3
610	I love this version of Little Women. It is family friendly--no language or junk--a gem that our whole family could watch!	1
611	I first fell in love with the book as a child and thought this movie was a wonderful adaptation of Alcott's writing.  Definitely a feel-good, nostalgic movie.	6
612	I bought this DVD for my friend for Christmas and she absolutely loved it. She watched it 3 times over Christmas vacation. It was very reasonably priced and arrived in a timely manner.Little Women (Collector's Edition)	6
613	This has become a holiday tradition to watch this well acted holiday movie every year with the whole family.... You should add it to your collection.	6
614	I have watched Little Women many times. This collector's series was wonderful and I really enjoyed seeing it again. It's one of my favorites. I received the dvd just a few days after ordering. The seller was quick in sending it to me. That's all I can say except that I love that movie.	6
615	This was the perfect Christmas gift for my daughter in law.  It is a classic as well as a wonderful collector's series.	6
616	the movie did follow the book... BUT the story itself was absolutely absurd and illogical.the ending was unexpected and unreasonable; JO SHOULD HAVE ENDED UP WITH LAURIE!!!!!!!!!Winona Ryder was horrible portraying Jo.The only good thing in this movie is Laurie (Christian Bale was fine tho!) and even he turned out weird!!!!	17
617	One of my favorite movies of all time, both for its beautiful cinematography and gentle humor. The director captures the period perfectly, and the acting is superb. It is one of the best family films to come out in the 90s. The world needs more high quality, wholesome movies like this! Bound to become a classic.	6
618	I feel this version of &quot;Little Women&quot; did Louisa May Alcott's book justice.  No, the film did not completely correspond with the book, but I can overlook that thanks to the beautiful musical score, the gorgeous scenery, and the superb acting talents of Winona Ryder and Susan Sarandon.  I highly recommend this heartwarming film!	2
619	I didn't like this movie too much, I think the director and script writer took too much of the book and added too much of their own, in a way that spoils the movie.The movie flaws over the most important parts of the book, and on the other hand gives great attention to events invented by the script writer. Throughout the movie there is a feeling that the most important parts of the book pop out of nowhere, for two minutes, and then talentlessly cut-off for some invented event.In addition the movie is filled with 20th century values, which are completely anachronistic to the time when the plot happenes. For example, there is a protest against Child Labor in China, which makes you wanna shout that even in the U.S and China there was child labor these days, so what's the point of putting it in. It feels as if the writer insults the viewer's intelligence by making his messages as clear as can be, and the credibility of the plot pays for it.The design of the characters is another problem. Jo is very feminine in this movie and hardly remind the book. Her famous exclamation "Christopher Colombus!" is replaced here by a weak "By Jehosafat"(?). The mother is presented like a hard person. The movie gets lost between the sisters and there is a feeling that none of the sisters get, eventually, enough attention.In conclusion, I think it's a badly written and talentlessly directed movie. I think it's a misinterpretation of the book, caused by a desparate try to be original and a lousy attempt to make the book "understood" for the modern person, as if anything that was written before 1990 is beyond our grasp. Thus, it ignores the fact that great litrature is timeless and eternal.	16
620	I love this movie! One of my all time favorites. But when I first watched it, started freezing up so had to take out and cleaned it. Than I put it back in and now it works perfect!	2
621	The Bottom Line:As a 20 year old male I was not expecting to be won over by this film, but it's an engaging story and was simply well-made; it's not perfect, and Eric Stolz looks completely out of place in the 19th century, but it's an enjoyable movie.	6
622	So this film is not as good as the book or earlier Little Women films, however, it is clean, touching, and well made.	6
623	The most interesting thing about the three film versions of "Little Women" is comparing them to each other or comparing each of them to Alcott's book.What makes them so difficult to choose between is that the casting of the four title characters is the critical element, and each film featured at least one actress whose performance was clearly superior to her character's portrayal in the other two films.This all star cast would include Jean Parker (Beth) in the 1933 version, Janet Leigh (Meg) in the 1949 version, and Winona Ryder (Jo) in the 1994 version. The 1994 version also had the best Amy, if only because they wisely split the role into a younger Amy (Kirsten Dunst) and an older Amy (Samantha Mathis).Since Jo is pretty clearly the most important of the four sisters (to the story), the 1994 version gets my nod as the best of the three films. The 1933 version pulls in as a close second as Joan Bennett and Katherine Hepburn are the second best Amy and Jo; and Francis Dee's Meg is as good as Trini Alvarado's. Neither Margaret O'Brien nor Claire Danes come even close to Parker's portrayal of Beth.The biggest casting problem all the productions had was in the age of the actresses. With the exception of Beth, all three characters must span a five year period. The casting process typically addressed this by selecting older actresses and getting them to play (with varying degrees of success) much (June Allyson was 32 years old) younger versions of themselves during the first half of the film.At least the 1994 versions managed to get the birth order right. The 1933 version had some problems in this area, as Hepburn was two years older than Dee and Bennett five years older than Parker. While this still causes many Alcott fans to cringe, it is nothing compared to the 1949 version where Allyson was ten years older than Leigh and Elizabeth Taylor was five years older than O'Brien.Taylor should have played Jo, which would have saved viewers from Allyson's embarrassing portrayal and from Taylor's attempt to pass as a blonde. Few actresses (even in black and white) were less suited to a light hair color. While Taylor's portrayal of Amy is painful, she would have been well suited to the Jo role.Critics frequently point out that both Hepburn and Allyson were much like Jo in real life, so there is a certain irony that Ryder's portrayal of the character (one so dissimilar to herself) was far superior. But Ryder and Jo have a similar level of intensity so maybe it was not as much a stretch as it seems.Then again, what do I know? I'm only a child.	2
624	I actually like this dramatization better than the original film starring Katharine Hepburn as Jo. I am a huge fan of the book but I give film the privilege of dramatic license to change things to make it work better. I definitely would recommend this film to those who not overly loyal to the film. If you are a die-hard book fan the 1930,s version is a better choice.	6
625	A timeless classic.  I have several versions.  This version being equal to the classics and my daughter's favorite version.	3
626	So, everything I ordered was handled well, on time and in perfect condition! I would purchase from this sight again.	6
627	I think it's a very well done movie, with great actors..I love the period and how they captured their lives in such a true spirit.	6
